{
  "$schema": "https://json-schema.org/draft/2020-12/schema",
  "$id": "https://perfeng.dev/schemas/baseline/v1/baseline.schema.json",
  "$defs": {
    "id": {
      "type": "string",
      "description": "a string matching the pattern ^[a-z][a-z0-9]*(?:-[a-z0-9]+)*$",
      "pattern": "^[a-z][a-z0-9]*(?:-[a-z0-9]+)*$"
    },
    "version": {
      "type": "string",
      "description": "a string matching the pattern ^(0|[1-9][0-9]*)\\.(0|[1-9][0-9]*)\\.(0|[1-9][0-9]*)$",
      "pattern": "^(0|[1-9][0-9]*)\\.(0|[1-9][0-9]*)\\.(0|[1-9][0-9]*)$"
    },
    "state": {
      "type": "string",
      "enum": [
        "CANDIDATE",
        "QUALIFIED",
        "APPROVED",
        "RETIRED"
      ]
    },
    "sha256": {
      "type": "string",
      "description": "a string matching the pattern ^[a-f0-9]{64}$",
      "pattern": "^[a-f0-9]{64}$"
    },
    "identity": {
      "type": "object",
      "required": [
        "id",
        "version",
        "sha256"
      ],
      "properties": {
        "id": {
          "$ref": "#/$defs/id"
        },
        "version": {
          "$ref": "#/$defs/version"
        },
        "sha256": {
          "$ref": "#/$defs/sha256"
        }
      },
      "additionalProperties": false
    },
    "timestamp": {
      "type": "string",
      "format": "date-time",
      "description": "a string matching the pattern ^\\d{4}-\\d{2}-\\d{2}T\\d{2}:\\d{2}:[0-5]\\d(?:\\.\\d{1,6})?(?:Z|[+-]\\d{2}:\\d{2})$",
      "pattern": "^\\d{4}-\\d{2}-\\d{2}T\\d{2}:\\d{2}:[0-5]\\d(?:\\.\\d{1,6})?(?:Z|[+-]\\d{2}:\\d{2})$"
    }
  },
  "type": "object",
  "required": [
    "schemaVersion",
    "kind",
    "id",
    "version",
    "revision",
    "state",
    "testId",
    "sourceRunId",
    "artifact",
    "software",
    "workload",
    "environment",
    "dataset",
    "qualification",
    "createdAt",
    "lifecycle"
  ],
  "properties": {
    "schemaVersion": {
      "type": "number",
      "enum": [
        1
      ]
    },
    "kind": {
      "type": "string",
      "enum": [
        "PerformanceBaseline"
      ]
    },
    "id": {
      "$ref": "#/$defs/id"
    },
    "version": {
      "$ref": "#/$defs/version"
    },
    "revision": {
      "type": "integer",
      "description": "a number between 1 and 9007199254740991",
      "title": "between(1, 9007199254740991)",
      "minimum": 1,
      "maximum": 9007199254740991
    },
    "state": {
      "$ref": "#/$defs/state"
    },
    "testId": {
      "$ref": "#/$defs/id"
    },
    "sourceRunId": {
      "type": "string",
      "description": "Reference to the run metadata",
      "pattern": "^perf-[0-9]{8}-[0-9]{6}-[a-f0-9]{8}$"
    },
    "artifact": {
      "type": "object",
      "required": [
        "id",
        "runId",
        "kind",
        "uri",
        "sha256",
        "sizeBytes",
        "mediaType",
        "format"
      ],
      "properties": {
        "id": {
          "type": "string",
          "format": "uuid"
        },
        "runId": {
          "type": "string",
          "description": "Reference to the run metadata",
          "pattern": "^perf-[0-9]{8}-[0-9]{6}-[a-f0-9]{8}$"
        },
        "kind": {
          "type": "string",
          "enum": [
            "normalized"
          ]
        },
        "uri": {
          "type": "string",
          "format": "uri",
          "description": "a string matching the pattern ^(s3|https):\\/\\/[^\\s?#]+$",
          "pattern": "^(s3|https):\\/\\/[^\\s?#]+$"
        },
        "sha256": {
          "$ref": "#/$defs/sha256"
        },
        "sizeBytes": {
          "type": "integer",
          "description": "a non-negative number",
          "title": "greaterThanOrEqualTo(0)",
          "minimum": 0
        },
        "mediaType": {
          "type": "string",
          "enum": [
            "application/json"
          ]
        },
        "format": {
          "type": "string",
          "enum": [
            "normalized-result/v1"
          ]
        }
      },
      "additionalProperties": false
    },
    "software": {
      "type": "object",
      "required": [
        "gitSha",
        "image"
      ],
      "properties": {
        "gitSha": {
          "type": "string",
          "description": "a string matching the pattern ^[A-Fa-f0-9]{40}$",
          "pattern": "^[A-Fa-f0-9]{40}$"
        },
        "image": {
          "type": "string",
          "description": "a string matching the pattern ^[a-z0-9][a-z0-9._:/-]*@sha256:[a-f0-9]{64}$",
          "pattern": "^[a-z0-9][a-z0-9._:/-]*@sha256:[a-f0-9]{64}$"
        },
        "version": {
          "type": "string",
          "description": "a string matching the pattern \\S",
          "title": "minLength(1)",
          "minLength": 1,
          "pattern": "\\S"
        }
      },
      "additionalProperties": false
    },
    "workload": {
      "$ref": "#/$defs/identity"
    },
    "environment": {
      "type": "object",
      "required": [
        "id",
        "version",
        "sha256",
        "fingerprint"
      ],
      "properties": {
        "id": {
          "$ref": "#/$defs/id"
        },
        "version": {
          "$ref": "#/$defs/version"
        },
        "sha256": {
          "$ref": "#/$defs/sha256"
        },
        "fingerprint": {
          "$ref": "#/$defs/sha256"
        }
      },
      "additionalProperties": false
    },
    "dataset": {
      "anyOf": [
        {
          "type": "object",
          "required": [
            "kind"
          ],
          "properties": {
            "kind": {
              "type": "string",
              "enum": [
                "none"
              ]
            }
          },
          "additionalProperties": false
        },
        {
          "type": "object",
          "required": [
            "kind",
            "id",
            "version",
            "sha256",
            "seed"
          ],
          "properties": {
            "kind": {
              "type": "string",
              "enum": [
                "versioned"
              ]
            },
            "id": {
              "$ref": "#/$defs/id"
            },
            "version": {
              "$ref": "#/$defs/version"
            },
            "sha256": {
              "$ref": "#/$defs/sha256"
            },
            "seed": {
              "type": "integer",
              "description": "a non-negative number",
              "title": "greaterThanOrEqualTo(0)",
              "minimum": 0
            }
          },
          "additionalProperties": false
        }
      ]
    },
    "qualification": {
      "type": "object",
      "required": [
        "status",
        "reasons"
      ],
      "properties": {
        "status": {
          "type": "string",
          "enum": [
            "PENDING",
            "PASSED",
            "FAILED"
          ]
        },
        "reasons": {
          "type": "array",
          "items": {
            "type": "string",
            "description": "a string matching the pattern \\S",
            "title": "minLength(1)",
            "minLength": 1,
            "pattern": "\\S"
          },
          "uniqueItems": true
        },
        "sampleCount": {
          "type": "integer",
          "description": "a number greater than or equal to 1",
          "title": "greaterThanOrEqualTo(1)",
          "minimum": 1
        },
        "maximumCv": {
          "type": "number",
          "description": "a non-negative number",
          "title": "greaterThanOrEqualTo(0)",
          "minimum": 0
        }
      },
      "additionalProperties": false,
      "allOf": [
        {
          "if": {
            "properties": {
              "status": {
                "const": "PASSED"
              }
            }
          },
          "then": {
            "required": [
              "sampleCount",
              "maximumCv"
            ]
          }
        },
        {
          "if": {
            "properties": {
              "status": {
                "const": "FAILED"
              }
            }
          },
          "then": {
            "properties": {
              "reasons": {
                "minItems": 1
              }
            }
          }
        }
      ]
    },
    "createdAt": {
      "$ref": "#/$defs/timestamp"
    },
    "lifecycle": {
      "type": "array",
      "items": {
        "type": "object",
        "required": [
          "state",
          "at",
          "actor",
          "reason"
        ],
        "properties": {
          "state": {
            "$ref": "#/$defs/state"
          },
          "at": {
            "$ref": "#/$defs/timestamp"
          },
          "actor": {
            "type": "string",
            "description": "a string at most 128 character(s) long",
            "title": "maxLength(128)",
            "minLength": 1,
            "pattern": "\\S",
            "maxLength": 128
          },
          "reason": {
            "type": "string",
            "description": "a string at most 1024 character(s) long",
            "title": "maxLength(1024)",
            "minLength": 1,
            "pattern": "\\S",
            "maxLength": 1024
          }
        },
        "additionalProperties": false
      },
      "description": "an array of at least 1 item(s)",
      "title": "minItems(1)",
      "minItems": 1
    }
  },
  "additionalProperties": false,
  "title": "Versioned performance baseline with explicit approval history"
}
